17,4,Which of the following is the major duty of the national security advisor?,Initiating bills concerning national security in the congress (Incorrect),Coordinating communication between the two chambers of Congress,Acting as the chief commander of the armed forces,Advising the president on foreign policy (Correct),Estimating and allocating budget for national security
17,5,Which of the following departments has the primary responsibility for managing the foreign affairs budget and resources and leading and coordinating US representation abroad?,Commerce department (Incorrect),Homeland security department,State department (Correct),Defense department,Treasury department
17,6,Which of the following acts was amended to establish the Defense Department?,National Security Act (Correct),Sedition Act,USA Patriot Act,Military Commissions Act,Civil Liberties Act
17,7,The Central Intelligence Agency _____.,is an agency created by the Patriot Act (Incorrect),is not authorized to collect its own information,"correlates, evaluates, and disseminates intelligence (Correct)",is controlled directly by the Senators,is an agency created after the 9/11 terrorist attacks
17,8,"Which of the following departments combines activities from 22 different federal agencies with a total workforce of 170,000 employees?",State department (Incorrect),Defense department,Commerce department,Homeland security department (Correct),Treasury department
17,9,Executive agreements require the consent of the Senate before becoming law.,True (Incorrect),False (Correct)
17,10,The president is considered more powerful over foreign policy than Congress. Which of the following is the reason for this?,President can amend the bills passed by the Congress. (Incorrect),President has the power to oversee the actions of the Congress.,President possesses budgetary powers.,President can take quicker decisions on foreign policy. (Correct),President can violate certain constitutional principles to improve foreign relations.
17,11,Which of the following refers to the Senate’s power to advice and consent?,Power to appoint Supreme Court judges (Incorrect),Constitutional authority to elect the president,Power to impeach the president,Power to advice national agencies,Constitutional authority to approve treaties (Correct)
17,12,Agreements that the president enters into with other states are called _____.,Executive agreements (Correct),Internal treaties,Individual agreements,Congressional agreements,Individual treaties
17,13,"According to Vietnam syndrome, Americans would not support military action if:",the military is sent to other countries for war. (Incorrect),the nation involves in the foreign policies of another nation.,it results in significant causalities to people across the globe.,a war is continued for more than a month.,it resulted in significant casualties to US troops. (Correct)
17,14,"According to theory of containment, nuclear weapons were too powerful and destructive to be used as instruments of warfare.",True (Incorrect),False (Correct)
17,15,Isolationism refers to the belief that US national interests are best served by avoiding involvement with foreign countries.,True (Correct),False
17,16,Which of the following arguments is consistent with the idea of isolationism?,United States should not send troupes to resolve the problems involving other countries. (Correct),A nation will have to interfere in events beyond its borders to accomplish and protect national interest.,United States should involve actively in the activities of the U.N.,Improving foreign relations and extending help is crucial to a democratic country’s growth.,Membership in treaties such as WTO is essential for the survival of a nation.
17,17,Which of the following refers to the belief that US national interests are best served by involvement with foreign countries?,Protectionism (Incorrect),Internationalism (Correct),Collectivism,Isolationism,Capitalism
17,18,Which of the following was the concept guiding American foreign policy in the cold war with the Soviet Union?,Passive responses to the opponent (Incorrect),Aggressive global policing,Containment of communism (Correct),Lobbying to obtain support of other communist nations,Aggressive promotion of capitalism
17,19,Which of the following statements describes the deterrence strategy used by the US during the cold war with the Soviet Union?,US did not respond to the actions of Soviet Union to pacify its moves. (Incorrect),US possessed nuclear weapons and that kept the Soviet Union in check. (Correct),US adopted a negative approach toward the conflicts with the Soviet Union.,US responded aggressively toward the criticisms raised by Soviet Union.,US used weapons to threaten the Soviet Union and its allies.
17,20,Preemption refers to the strategy of removing threats before they harm the United States.,True (Correct),False
17,21,Which of the following strategies for employing military power refers to removing threats before they are capable of harming?,Predominance (Incorrect),Containment,Deterrence,Preemption (Correct),Avoidance
17,22,The United States must possess a significant military power advantage over all other states so that it can act unilaterally to defend its national interests when and where it sees fit. This idea refers to the doctrine of _____.,preemption (Incorrect),containment,deterrence,avoidance,predominance (Correct)
17,23,WikiLeaks is an organization that gets funding from the US to collect information about the policies of other countries.,True (Incorrect),False (Correct)
17,24,Public diplomacy refers to _____.,public involvement in policy making and implementation during times of war (Incorrect),US policymakers’ efforts to gain the approval and support of the members of challenging political parties,threatening other nations to obtain support for the policy decisions of a nation,public involvement in policy making and implementation during times of war,US policymakers’ efforts to gain the approval and support of policymakers in foreign countries (Correct)
17,25,WikiLeaks is an organization that _____.,exposes official secrets to increase transparency (Correct),promotes the use of technology in governmental organizations,functions as the premier intelligence agency in the United States,gets funding from the US for carrying out intelligence acts,serves as the independent agency of the US government
